Geocachen;Using multimillion dollar military satellites to find tupperware in the woods;activiteit_geocaching.png;2
Fietsen;Lekker fietsen op de fiets;activiteit_fiets.png;5
Testen;testen voor molveno;activiteit_test.png;1
Wijnproeven;Voor de alcoholisten onder ons is het mogelijk je te bezatten onder het mom van het proeven van wijn.;activiteit_wijn.png;6
SUP;Lekker rond de tafel zitten tafelen;activiteit_sup.png;25
Tegeltjes;Voor de crea-beas onder de gasten is de mogelijkheid om onder begeleidnig van professionele artisten, keramieke tegeltjes te maken.;activiteit_tegel.png;4
Bowlen;Bowlen bij de buren;activiteit_bowlen.png;11
Wandelen;Wandelen In de omgeving van het hotel zijn legio mogelijkheden om leuke wandlingen te maken.;activiteit_wandel.png;18
Vissen;Lekker je hengeltje uitgooien in het meer.;activiteit_vissen.png;8
